{
  "$schema": "https://json-schema.org/draft/2020-12/schema",
  "$id": "https://urbe.local/quests/flow/schema/questline.schema.json",
  "title": "QuestlineDefinition",
  "type": "object",
  "additionalProperties": false,
  "required": ["id", "title", "premise", "roles", "items", "facts", "acts", "steps", "endings", "flags", "entryStepIds"],
  "properties": {
    "id": { "$ref": "#/$defs/id" },
    "title": { "$ref": "#/$defs/text" },
    "premise": { "$ref": "#/$defs/text" },
    "prologue": { "$ref": "#/$defs/text", "description": "What the player reads before the story starts: who they are, where they stand and the job that opens the story, in the second person." },
    "offeredAfter": { "$ref": "#/$defs/id", "description": "A side questline's gate: the main questline's step the player finishes before this job is offered. Absent, it is on offer from the start; the main questline carries none." },
    "roles": { "type": "array", "items": { "$ref": "#/$defs/role" } },
    "items": { "type": "array", "items": { "$ref": "#/$defs/item" } },
    "facts": { "type": "array", "items": { "$ref": "#/$defs/fact" } },
    "acts": { "type": "array", "minItems": 1, "items": { "$ref": "#/$defs/act" } },
    "steps": { "type": "array", "minItems": 1, "items": { "$ref": "#/$defs/step" } },
    "endings": { "type": "array", "minItems": 1, "items": { "$ref": "#/$defs/ending" } },
    "flags": { "type": "array", "items": { "$ref": "#/$defs/id" }, "uniqueItems": true },
    "entryStepIds": { "type": "array", "minItems": 1, "items": { "$ref": "#/$defs/id" }, "uniqueItems": true }
  },
  "$defs": {
    "id": { "type": "string", "minLength": 1 },
    "text": { "type": "string", "minLength": 1 },
    "role": {
      "type": "object",
      "additionalProperties": false,
      "required": ["roleId", "npcType", "persona"],
      "properties": {
        "roleId": { "$ref": "#/$defs/id" },
        "npcType": { "$ref": "#/$defs/id" },
        "persona": { "$ref": "#/$defs/text" },
        "characterName": {
          "type": "object",
          "additionalProperties": false,
          "required": ["given", "family"],
          "properties": { "given": { "$ref": "#/$defs/text" }, "family": { "$ref": "#/$defs/text" } }
        },
        "reservedName": {
          "type": "object",
          "additionalProperties": false,
          "required": ["given", "family"],
          "properties": { "given": { "$ref": "#/$defs/text" }, "family": { "$ref": "#/$defs/text" } }
        }
      }
    },
    "item": {
      "type": "object",
      "additionalProperties": false,
      "required": ["itemId", "name", "description", "kind"],
      "properties": {
        "itemId": { "$ref": "#/$defs/id" },
        "name": { "$ref": "#/$defs/text" },
        "description": { "$ref": "#/$defs/text" },
        "kind": { "enum": ["device", "weapon", "document", "key", "substance", "valuable", "information"] },
        "atParcelId": { "$ref": "#/$defs/id" },
        "opens": {
          "description": "A key or device that opens one locked door: the building and the door by its address there, as the host numbers it (apartment 1407, archive 302).",
          "type": "object",
          "additionalProperties": false,
          "required": ["parcelId", "door"],
          "properties": { "parcelId": { "$ref": "#/$defs/id" }, "door": { "$ref": "#/$defs/text" } }
        }
      }
    },
    "fact": {
      "type": "object",
      "additionalProperties": false,
      "required": ["factId", "roleId", "text"],
      "properties": {
        "factId": { "$ref": "#/$defs/id" },
        "roleId": { "$ref": "#/$defs/id" },
        "text": { "$ref": "#/$defs/text" },
        "gateFlag": { "$ref": "#/$defs/id" }
      }
    },
    "act": {
      "type": "object",
      "additionalProperties": false,
      "required": ["actId", "title", "summary"],
      "properties": {
        "actId": { "$ref": "#/$defs/id" },
        "title": { "$ref": "#/$defs/text" },
        "summary": { "$ref": "#/$defs/text" }
      }
    },
    "ending": {
      "type": "object",
      "additionalProperties": false,
      "required": ["endingId", "title", "epilogue"],
      "properties": {
        "endingId": { "$ref": "#/$defs/id" },
        "title": { "$ref": "#/$defs/text" },
        "epilogue": { "$ref": "#/$defs/text" }
      }
    },
    "place": {
      "description": "One world identity plus the venue's name: the world's own name when it has one, else the word for that kind of building.",
      "oneOf": [
        {
          "type": "object",
          "additionalProperties": false,
          "required": ["parcelId", "name"],
          "properties": { "parcelId": { "$ref": "#/$defs/id" }, "name": { "$ref": "#/$defs/text" } }
        },
        {
          "type": "object",
          "additionalProperties": false,
          "required": ["districtId", "name"],
          "properties": { "districtId": { "$ref": "#/$defs/id" }, "name": { "$ref": "#/$defs/text" } }
        },
        {
          "type": "object",
          "additionalProperties": false,
          "required": ["stationId", "name"],
          "properties": { "stationId": { "$ref": "#/$defs/id" }, "name": { "$ref": "#/$defs/text" } }
        },
        {
          "type": "object",
          "additionalProperties": false,
          "required": ["stopId", "name"],
          "properties": { "stopId": { "$ref": "#/$defs/id" }, "name": { "$ref": "#/$defs/text" } }
        }
      ]
    },
    "window": {
      "type": "object",
      "description": "The hour a step's own text names, checked by the runtime. Weekly, simulation time convention (0 = Monday).",
      "additionalProperties": false,
      "required": ["label", "days", "startMin", "endMin"],
      "properties": {
        "label": { "$ref": "#/$defs/text" },
        "days": { "type": "array", "minItems": 1, "uniqueItems": true, "items": { "type": "integer", "minimum": 0, "maximum": 6 } },
        "startMin": { "type": "integer", "minimum": 0, "maximum": 1439 },
        "endMin": { "type": "integer", "minimum": 1, "maximum": 1440 }
      }
    },
    "target": {
      "oneOf": [
        {
          "type": "object",
          "additionalProperties": false,
          "required": ["kind", "place"],
          "properties": { "kind": { "const": "goto" }, "place": { "$ref": "#/$defs/place" } }
        },
        {
          "type": "object",
          "additionalProperties": false,
          "required": ["kind", "districtId"],
          "properties": { "kind": { "const": "observe" }, "districtId": { "$ref": "#/$defs/id" } }
        },
        {
          "type": "object",
          "additionalProperties": false,
          "required": ["kind", "roleId"],
          "properties": {
            "kind": { "const": "talk" },
            "roleId": { "$ref": "#/$defs/id" },
            "atParcelId": { "$ref": "#/$defs/id" }
          }
        },
        {
          "type": "object",
          "additionalProperties": false,
          "required": ["kind", "roleIds", "atParcelId"],
          "properties": {
            "kind": { "const": "listen" },
            "roleIds": {
              "type": "array",
              "minItems": 2,
              "maxItems": 2,
              "items": { "$ref": "#/$defs/id" }
            },
            "atParcelId": { "$ref": "#/$defs/id" }
          }
        },
        {
          "type": "object",
          "additionalProperties": false,
          "required": ["kind", "itemId"],
          "properties": { "kind": { "const": "pickup" }, "itemId": { "$ref": "#/$defs/id" } }
        },
        {
          "type": "object",
          "additionalProperties": false,
          "required": ["kind", "itemId", "place"],
          "properties": {
            "kind": { "const": "deliver" },
            "itemId": { "$ref": "#/$defs/id" },
            "place": { "$ref": "#/$defs/place" }
          }
        },
        {
          "type": "object",
          "additionalProperties": false,
          "required": ["kind", "itemId", "fromRoleId"],
          "properties": {
            "kind": { "const": "steal" },
            "itemId": { "$ref": "#/$defs/id" },
            "fromRoleId": { "$ref": "#/$defs/id" }
          }
        },
        {
          "type": "object",
          "additionalProperties": false,
          "required": ["kind", "roleId"],
          "properties": { "kind": { "const": "assassinate" }, "roleId": { "$ref": "#/$defs/id" } }
        },
        {
          "type": "object",
          "additionalProperties": false,
          "required": ["kind", "atParcelId", "role"],
          "properties": {
            "kind": { "const": "work" },
            "atParcelId": { "$ref": "#/$defs/id" },
            "role": { "$ref": "#/$defs/text" }
          }
        },
        {
          "type": "object",
          "additionalProperties": false,
          "required": ["kind", "sceneId", "evidenceId", "evidenceItemId", "subjectRoleIds", "place", "completionFlag"],
          "properties": {
            "kind": { "const": "investigation" },
            "sceneId": { "$ref": "#/$defs/id" },
            "evidenceId": { "$ref": "#/$defs/id" },
            "evidenceItemId": { "$ref": "#/$defs/id" },
            "subjectRoleIds": {
              "type": "array",
              "uniqueItems": true,
              "items": { "$ref": "#/$defs/id" }
            },
            "place": { "$ref": "#/$defs/place" },
            "completionFlag": { "$ref": "#/$defs/id" }
          }
        },
        {
          "type": "object",
          "additionalProperties": false,
          "required": ["kind", "roleId", "releaseTargetId", "place", "completionFlag"],
          "properties": {
            "kind": { "const": "rescue" },
            "roleId": { "$ref": "#/$defs/id" },
            "releaseTargetId": { "$ref": "#/$defs/id" },
            "place": { "$ref": "#/$defs/place" },
            "completionFlag": { "$ref": "#/$defs/id" }
          }
        },
        {
          "type": "object",
          "additionalProperties": false,
          "required": ["kind", "roleId", "routeId", "mode", "from", "to", "completionFlag"],
          "properties": {
            "kind": { "const": "escort" },
            "roleId": { "$ref": "#/$defs/id" },
            "routeId": { "$ref": "#/$defs/id" },
            "mode": { "enum": ["follow-player", "lead-player"] },
            "from": { "$ref": "#/$defs/place" },
            "to": { "$ref": "#/$defs/place" },
            "completionFlag": { "$ref": "#/$defs/id" }
          }
        },
        {
          "type": "object",
          "additionalProperties": false,
          "required": ["kind", "accessPointId", "credentialItemId", "place", "completionFlag"],
          "properties": {
            "kind": { "const": "access" },
            "accessPointId": { "$ref": "#/$defs/id" },
            "credentialItemId": { "$ref": "#/$defs/id" },
            "door": {
              "description": "The access point is this locked door of the place's building, by its address there (apartment 1407): the host's lock plays it, with no mission asset.",
              "$ref": "#/$defs/text"
            },
            "place": { "$ref": "#/$defs/place" },
            "completionFlag": { "$ref": "#/$defs/id" }
          }
        },
        {
          "type": "object",
          "additionalProperties": false,
          "required": ["kind", "targetId", "place", "completionFlag"],
          "properties": {
            "kind": { "const": "hacking" },
            "targetId": { "$ref": "#/$defs/id" },
            "place": { "$ref": "#/$defs/place" },
            "completionFlag": { "$ref": "#/$defs/id" }
          }
        },
        {
          "type": "object",
          "additionalProperties": false,
          "required": ["kind", "targetId", "place", "completionFlag"],
          "properties": {
            "kind": { "const": "sabotage" },
            "targetId": { "$ref": "#/$defs/id" },
            "place": { "$ref": "#/$defs/place" },
            "completionFlag": { "$ref": "#/$defs/id" }
          }
        },
        {
          "type": "object",
          "additionalProperties": false,
          "required": ["kind", "journeyId", "mode", "from", "to", "passengerRoleIds", "cargoItemIds", "completionFlag"],
          "properties": {
            "kind": { "const": "transportation" },
            "journeyId": { "$ref": "#/$defs/id" },
            "mode": { "enum": ["ride-hail", "public-transit", "vehicle", "animal", "aircraft"] },
            "from": { "$ref": "#/$defs/place" },
            "to": { "$ref": "#/$defs/place" },
            "passengerRoleIds": {
              "type": "array",
              "uniqueItems": true,
              "items": { "$ref": "#/$defs/id" }
            },
            "cargoItemIds": {
              "type": "array",
              "uniqueItems": true,
              "items": { "$ref": "#/$defs/id" }
            },
            "completionFlag": { "$ref": "#/$defs/id" }
          }
        }
      ]
    },
    "predicate": {
      "oneOf": [
        {
          "type": "object",
          "additionalProperties": false,
          "required": ["kind", "flag"],
          "properties": { "kind": { "enum": ["flagSet", "flagNotSet"] }, "flag": { "$ref": "#/$defs/id" } }
        },
        {
          "type": "object",
          "additionalProperties": false,
          "required": ["kind", "stepId"],
          "properties": { "kind": { "const": "stepDone" }, "stepId": { "$ref": "#/$defs/id" } }
        },
        {
          "type": "object",
          "additionalProperties": false,
          "required": ["kind", "roleId"],
          "properties": { "kind": { "enum": ["roleAlive", "roleOnDuty"] }, "roleId": { "$ref": "#/$defs/id" } }
        }
      ]
    },
    "flagOp": {
      "oneOf": [
        { "type": "object", "additionalProperties": false, "required": ["kind"], "properties": { "kind": { "enum": ["resign", "die"] } } },
        {
          "type": "object",
          "additionalProperties": false,
          "required": ["kind"],
          "properties": { "kind": { "const": "promote" }, "toParcelId": { "$ref": "#/$defs/id" } }
        },
        {
          "type": "object",
          "additionalProperties": false,
          "required": ["kind", "tag"],
          "properties": { "kind": { "const": "custom" }, "tag": { "$ref": "#/$defs/id" } }
        }
      ]
    },
    "effect": {
      "oneOf": [
        {
          "type": "object",
          "additionalProperties": false,
          "required": ["kind", "flag"],
          "properties": { "kind": { "enum": ["setFlag", "clearFlag"] }, "flag": { "$ref": "#/$defs/id" } }
        },
        {
          "type": "object",
          "additionalProperties": false,
          "required": ["kind", "roleId", "op"],
          "properties": {
            "kind": { "const": "simFlag" },
            "roleId": { "$ref": "#/$defs/id" },
            "op": { "$ref": "#/$defs/flagOp" }
          }
        }
      ]
    },
    "next": {
      "type": "object",
      "additionalProperties": false,
      "required": ["toStepId", "when"],
      "properties": {
        "toStepId": { "$ref": "#/$defs/id" },
        "when": { "type": "array", "items": { "$ref": "#/$defs/predicate" } }
      }
    },
    "dialogue": {
      "type": "object",
      "additionalProperties": false,
      "required": ["opening", "choices"],
      "properties": {
        "timing": {
          "type": "object", "additionalProperties": false, "required": ["seconds", "fallback"],
          "properties": { "seconds": { "type": "number", "exclusiveMinimum": 0 }, "fallback": { "$ref": "#/$defs/id" } }
        },
        "opening": { "$ref": "#/$defs/text" },
        "choices": {
          "type": "array",
          "minItems": 1,
          "contains": { "type": "object", "required": ["completesStep"], "properties": { "completesStep": { "const": true } } },
          "items": {
            "type": "object",
            "additionalProperties": false,
            "required": ["id", "text", "reply", "completesStep"],
            "properties": {
              "id": { "$ref": "#/$defs/id" },
              "text": { "$ref": "#/$defs/text" },
              "reply": { "$ref": "#/$defs/text" },
              "completesStep": { "type": "boolean" },
              "nextStepId": { "$ref": "#/$defs/id" }
            }
          }
        }
      }
    },
    "step": {
      "type": "object",
      "additionalProperties": false,
      "required": ["stepId", "actId", "narrative", "target", "gives", "needs", "conditions", "effects", "next", "branching"],
      "if": { "required": ["dialogue"], "properties": { "dialogue": {} } },
      "then": { "properties": { "target": { "type": "object", "properties": { "kind": { "const": "talk" } } } } },
      "properties": {
        "dialogue": { "$ref": "#/$defs/dialogue" },
        "stepId": { "$ref": "#/$defs/id" },
        "actId": { "$ref": "#/$defs/id" },
        "narrative": {
          "type": "object",
          "additionalProperties": false,
          "required": ["description", "playerHint", "stake"],
          "properties": {
            "description": { "type": "string" },
            "playerHint": { "$ref": "#/$defs/text" },
            "stake": { "$ref": "#/$defs/text" }
          }
        },
        "wantedByRoleId": { "$ref": "#/$defs/id" },
        "target": { "$ref": "#/$defs/target" },
        "window": { "$ref": "#/$defs/window" },
        "gives": { "type": "array", "items": { "$ref": "#/$defs/id" }, "uniqueItems": true },
        "needs": { "type": "array", "items": { "$ref": "#/$defs/id" }, "uniqueItems": true },
        "conditions": { "type": "array", "items": { "$ref": "#/$defs/predicate" } },
        "effects": { "type": "array", "items": { "$ref": "#/$defs/effect" } },
        "next": { "type": "array", "items": { "$ref": "#/$defs/next" } },
        "branching": { "enum": ["parallel", "exclusive"] },
        "endingId": { "$ref": "#/$defs/id" }
      }
    }
  }
}
